Title,Artist,Lyrics
Go Crazy,Chris Brown & Young Thug,"[Intro: Chris Brown]
Oh, yeah
(Oh, is that Kaniel again?)
Oh
(Ayy, bring it, bring it back, bring it back, bring it back)
Oh, yeah

[Verse 1: Chris Brown]
Laid up, got me thinkin', babe
Tell me if you with it 'cause I'm with it, babe
I haven't heard from you in a minute, babe
Just tell me what to do when I get it, babe
Gucci and Prada

[Pre-Chorus: Chris Brown]
Trips to your crib in the middle of the night
I know that you miss me 'cause I put it down right
Damn, babe, I can put you on a flight
You know that a nigga like me can change your life

[Chorus: Chris Brown & Young Thug]
Oh, baby
Everything you do is amazing
Ain't nobody watchin', go crazy
I got what you need
Everybody think you shy, but I know you a freak, lil' baby (Oh)
Everything you do is amazing (Yeah)
Ain't nobody watchin', go crazy (Yeah)
I got what you need (Yeah)
Everybody think you shy, but I know you a freak, lil' baby (Yeah)

[Verse 2: Young Thug & Chris Brown]
I been overseas goin' crazy (Yeah)
I can tell you love it when we made up (Ayy)
Black and gray diamonds like a Raider (Raider)
Orange peel, your love is real (Yeah)
Lovin' skills, I need some lovin' skills (Yeah)
Left my dirty drawers and you love me still (Yeah)
Eyes come lazy, but she is real (Yeah)
Dressed to kill (Yeah, yeah, yeah)
We can bum-bum 'til you're tired (Oh)
I can put a stone by your eye (Oh)
I can see you never switchin' sides
You never tell me lies
Not rushin' tie-ties, yeah

[Pre-Chorus: Chris Brown]
Trips to your crib in the middle of the night
I know that you miss me 'cause I put it down right
Damn, babe, I can put you on a flight
You know that a nigga like me can change your life

[Chorus: Chris Brown]
Oh, baby
Everything you do is amazing
Ain't nobody watchin', go crazy (I got what you need)
I got what you need
Everybody think you shy, but I know you a freak, lil' baby

[Verse 3: Chris Brown]
Yeah, get me lit
Hoes on my phone when they find out that I'm rich
Then they switch when they see I'm choosin' on my bitch
Top down, got her doin' donuts on the dick, yeah
Pose for the flick
Damn it, bust it, baby, watch you do it on a split
She don't need no hands or no pants, do your dance
Poppin' rubber bands, did the dash, make it fast (Oh)
(Ayy, bring it, bring it back, bring it back, bring it back)
Yeah, waitin' by me phone just to dick you down, down
Let me put it down, down
Now put it down, down
Watch me put it down, down (Bring it back, bring it back, bring it back)
Put it down, down

[Pre-Chorus: Chris Brown]
Trips to your crib in the middle of the night
I know that you miss me 'cause I put it down right
Damn, babe, I can put you on a flight
You know that a nigga like me can change your life

[Chorus: Chris Brown]
Oh, baby
Everything you do is amazing
Ain't nobody watchin', go crazy
I got what you need
Everybody think you shy, but I know you a freak, lil' baby (Oh)
Everything you do is amazing (Yeah)
Ain't nobody watchin', go crazy
I got what you need
Everybody think you shy, but I know you a freak, lil' baby"
D4L,"Future, Drake & Young Thug","[Intro: Young Thug]
(808 my crew)
(Ayy, Southside, where you get all that drip?)
Yeah, yeah
Yeah

[Chorus: Young Thug & Future]
FBG, YSL, know just what's brackin', yeah (Yeah, yeah)
Told my story, gotta clear it by your daddy, yeah (Yeah, yeah)
FBG, YSL, what's hannenin'? (What's hannenin'?)
Richard Mille, all this year, nigga, what's hannenin'? (What's hannenin'?)
Louis Vuitton bandana, bro, what hannenin'? (What's hannenin'?)
D4L, Stunna Man, say what's hannenin'? (What's hannenin'?)
Bowen Homes, you know, that shiesty shit (What's hannenin'?)
You go outside, you better back it

[Verse 1: Future & Young Thug]
Oh, my right wrist a Ferrari (Skrrt, skrrt)
Foreign breed, American, she call me papi (Yeah, yeah, yeah)
Vroom, vroom, Hellcat, give it to the goons (Vroom)
On that Earl Manigault, shootin' it out the spoon
Seen a prom queen smoke crack when I was lil'
Million dollars in cash like I sell drugs (Sell drugs)
Gave my bitch a hundred racks, vacuum sealed up (Vacuum seal, what?)
Vacuum sealed up

[Chorus: Young Thug & Drake]
FBG, YSL, know just what's brackin', yeah (Yeah, yeah)
Told my story, gotta clear it by your daddy, yeah (Yeah, yeah)
FBG, OVO, what's hannenin'? (What's hannenin'?)
Richard Mille, all year, what's hannenin'? (What's hannenin'?)
YSL bandana, man, what's hannenin'? (What's hannenin'?)
D4L, Stunna Man, man, what's hannenin'? (What's hannenin'?)
Bowen Homes, you know, that shiesty shit (What's hannenin'?)
You go outside, you better back it (Ayy)

[Verse 2: Drake]
Go to Palm Springs for a daytrip
Freeband, October's Own, it's the same shit
Shawty keep on knockin' back the shots, better pace this
Woah, woah, bank knows presidential faces
Woah, woah, Bankhead, started seein' spaceships, woah
We just started fuckin', she impatient
Now she want a butt lift, now she want some LASIK
Just to see the bag clearer, that way she can chase it
Ayy, ayy
I remember grade six, I was up in Payless tryna get some Asics
Now I'm Nike'd down in a motherfuckin' snake pit
Now I'm type of nigga give it out and I don't take shit (808 my crew)

[Verse 3: Future & Young Thug]
I been in the cut for thirteen thousand months
(Ayy, Southside, where you get all that drip?)
All that brr, you gon' think we from Saudi Arabia
Money counter brr (Yeah), ayy
My trap comin' up the street, brr (Let's go)
I ran a check up on my feet, brr (Run it up)
Bentley talk, Bentley talk, brr (Bentley)
Go ask your mama, I'm a boss, brr (Boss)
I got oil, I'm your daddy, brr (Daddy)
I bought her a 'Rari (Swerve, skrrt), brr ('Rari, yeah)
I eat calamari (Brr, yeah, yeah, yeah)
I'ma let her park me

[Chorus: Young Thug & Future]
FBG, YSL, know just what's brackin', yeah (Yeah, yeah, yeah)
Told my story, gotta clear it by your daddy, yeah (Yeah)
FBG, YSL, what's hannenin'? (What's hannenin'?)
Richard Mille, all this year, nigga, what's hannenin'? (What's hannenin'?)
Louis Vuitton bandana, bro, what hannenin'? (What's hannenin'?)
D4L, Stunna Man, say what's hannenin'? (What's hannenin'?)
Bowen Homes, you know, that shiesty shit (What's hannenin'?)
You go outside, you better back it"
Godzilla,Eminem Featuring Juice WRLD,"Ох, да ты просто монстр

[Куплет 1: Dicon]
Я могу выпить бутылку. Алкоголь - и я, словно Гадзилла
Попаду в колоду, будто крупье в казино
Весь мой сквад тут на тусе ходит туда-сюда
Помесь зомби апокалипсиса и Бобби Хинана ""Мозга"" я
Ведь со мной вновь сражается также моя же мания
Shady вернулся, взрывать пора
Говоришь, от меня клонит в сон тебя?
Вот тогда тебе бессоница
У тебя дефицит внимания, успокойся и слушай сейчас меня
Чел, выпей коньяка
Убью из АК с кулака, для меня это не больше, чем игра
Отсякай, видишь меня отступай, тут орёт тревога
Этот бит сумасшедший, смешной (хах), как будто Ray J
Угараю по дороге до банка, брызжа слюной, вам не успокоить
Во мне...

[Припев: Dicon]
Монстра
Встанешь на пути моём, скормлю тебя монстру
Весь день такой как ты, но ночью превращаюсь в монстра
При свете луны, что сияет так ясно
Я становлюсь злодеем. Это мой блокбастер
Гадзилла, всё в огне, я монстр
В крови ковёр луи ви, в крови весь танцпол
Всё горит, Гадзилла, всё в огне, я монстр
В крови ковёр луи ви, в крови весь танцпол

[Куплет 2: Dicon]
Я лишь продукт Слика Рика из Оникса, своим треком их ужасну
Разозлю, хоть их сотни всех. Невозможно даже перечесть
И вдобавок ко всему этому я в психушке в руках верчу
Магический шар
В попытках узнать, каково будет завтра:
После рисперидона будет ли шанс?
Мой кулак, будто карандаш, чертит круги на стене
Черти кричат все во мне
Эта песня даст веру тебе
Ты направил свой ствол на парня с базукой в руке
Я из Лох-Несса вылез, прямо из мифов
Как только грохну свой полтиник водки
Лишь откручу крышку, ты увидишь...

[Припев: Dicon]
Монстра
Встанешь на пути моём, скормлю тебя монстру
Весь день такой как ты, но ночью превращаюсь в монстра
При свете луны, что сияет так ясно
Я становлюсь злодеем. Это мой блокбастер
Гадзилла, всё в огне, я монстр
В крови ковёр луи ви, в крови весь танцпол
Всё горит, Гадзилла, всё в огне, я монстр
В крови ковёр луи ви, в крови весь танцпол

[Куплет 3: Dicon]
Если тебе так же пох, руки вверх!
Ведь я уже собрался в отдых. Бэд Трип подъехал
Нахожусь на месте, как мой индекс, теперь всё, что ты увидишь
Лишь мой средний палец, подниму выше!
Как у меня могут быть только фаны?
Горю, как у лжеца память
Я не думал вас даже оставить без восхищений текстами
И эти дамы прекрасны, меня заводят опасно
И я их очаровал всех, они теряют сознание
И всё снова крутится, крутится, словно цепь бензопилы
Я машу волшебной палочкой, как битой, исполню мечты
Сука, я сделал эти бабки слишком просто как Кид Инк
Называй меня Дидди
Создаю группы, что мне дают прибыль
Слышь, я в игре, скуп на делёж, что принадлежит мне
Я не дам слова тебе, не притворюсь даже, мэн
Но я сказал суке, что женюсь на ней, если она после будет в земле
Я как Ричард Рамирес ебашу людей
Не стою на месте, как Кристиан Ривера
Все мои тексты вихляют подобно мне
Как при параличе, это страшно, я зову что Гарри Карей
Ведь каждый Том. Дик и Гарри всегда имеют грёбанный словарь при себе
Это смешно и нелепо. Ведь они подобно мне
Трясутся над ним, божатся, клянутся над ним
Пришло время пересечься с глазу на глаз с этой острой проблемой
Пора быстрее, составить некролог о каждом. Теперь и мне похер, поверь
Пора палить, зарядил ствол, полон чернил он
Злая половина меня сместит вновь, и людей привлекают мои тексты всё ещё
Он смотрят на них, как на гангстеров
Будто я буду щас стрелять всех
Каждый трей, как джингл, в магазин вложил их
Теперь пришло время их всех положить!

Наполняю ядом и рядом перебиваю
Другими словами, я из них соки выжимаю
Не хотел убивать всех, но я в приступе ярости
Ты не в силах сбежать теперь, я не чувствую жалости
Они меня ненавидят, и я не знаю усталости, и вот я настигаю их
И перемалываю в ярости
Я чувствую, будто бы стал на голову тронутым, во мне демон
И я знаю, он по крови их голоден
Либо ты убиваешь, либо убит будешь скоро ты, я подорву тебя
И раскидаю в разные стороны
Моя каждая часть сделана из зла и насилия
Если ты меня увидишь, то поверь, ты бессилен
Убегай или молись, но никак не беси меня, или в ту же минуту
Я разорву на куски тебя
Ты не станешь как я даже на пару процентов
Я собираюсь покончить с тобой, ты знаешь об этом
Меня подобные тебе вызывают на бэттл, но я не победим
Вовсе не убиваем и неподелен
Переделываю строки и не знаю предела я
У меня есть много денег, они раскиданы в трейлере
Я не боюсь потянутся за моим...

Чел стой
Смотри что в планах!
Хах"
All In,Lil Baby,"[Intro]
(Cook that shit up, Quay)

[Verse 1]
My mama been told me don't give no poor performance
And whatever you gon' do, just do it
Never thought 'bout doin' music
I was tryna build my phone up
Contacts full of drug abusers
Ridin' around with that Mexican, tryna figure out what my cousin doin'
Prison with the 'migos, found out they was sellin' bricks
Wish I would've knew that shit, I would've been lit
Swear to God, since I was seventeen, I been hood rich
I be at James Harden house, I'm all in Houston in the mix
I'm talkin' 'bout spare time in New York, I buy floor seats to watch the Knicks
And I don't even know no players
I just wan' show off my new drip and put my chains in layers
I might just stand up and go crazy, someone make the layup
And we ain't squashin' shit for free, you niggas gotta pay us
You niggas better pay up, yeah
Know he might not beat it, I told the lawyer go for a lighter sentence
I don't want know no problems with y'all niggas, y'all got women tendencies
I don't gotta sell drugs no more, I'm bossed up, I got plenty business
Ridin' 'round in that Lam' truck, I wreck this bitch, it ain't rented
Givin' out my respect, get respect in every city
Niggas know I came up, but I came back through the slums with Diddy
Fucked around and got plugged in, I'm buyin' that red Richard Mille
Stay out my lil' brother business, just know that they gettin' millions

[Chorus]
Press the button right there to let the doors in
Go hard all year, I don't care, I'm goin' all in
This house, vibes everywhere, she callin' more friends
My word or nothin', I ain't lyin', I cannot bargain

[Verse 2]
Sippin' wockiana, come here, thotiana
Let me bust you down, ah, yeah, yeah
What kinda watch you wanted?
Man, that's nothin', mami
I'm not bein' funny, yeah, yeah, yeah
I should've knew you was gon' rat the day you told me
A hundred racks in all dubs, it ain't no foldin' me
I ain't no puppet, I ain't with nobody controllin' me
I go LeBron when it's crunch time, it ain't no holdin' me
You got the Maybach, Benz truck, I'm tryna buy one
I told lil' shawty just let bygones be bygones
Tell the feds get off my dick, I don't gotta buy guns
They got the right one, yeah

[Chorus]
Press the button right there to let the doors in
Go hard all year, I don't care, I'm goin' all in
This house, vibes everywhere, she callin' more friends
My word or nothin', I ain't lyin', I cannot bargain

[Outro]
To let the doors in
I'm goin' all in
She callin' more friends
I cannot bargain"
Change Your Life,Kehlani Featuring Jhene Aiko,"[Verse 1: Kehlani]
I heard that you a gang-gang-gangsta
Not one to try to sa-sa-save her
Always focus on your paper
Don't got time to wager with your heart
I'm tryin' to switch up your cadence
Book flights and vaca-ca-cations
Tequila and rela-la-lations
Kissin' on new places, oh whoa

[Chorus: Kehlani & Jhené Aiko]
Baby, let me change your life
You wanna see (Everything)
That you can be anything you want (Anything)
Baby, let me change your life
You oughta be (Everything)
You oughta be anything (Anything)
Baby, I can make you right
You wanna see (Everything)
That you can be anything you want (Anything)
Baby, let me change your life
You wanna be (Everything)
You wanna be anything (Anything)
You could be anything, everything (Yeah)

[Verse 2: Jhené Aiko]
I'm not sayin' that you incomplete, but
Just imagine what we'd be if we became one
You deserve someone that'll take you to another level
Let me put you on
You've got so much potential, I really am fuckin' with you
Just open your heart
I'm tryna get you right, take you to the other side

[Chorus: Kehlani, Jhené Aiko, Both]
Baby, let me change your life
You wanna see (Everything, ooh, woah)
That you can be anything you want (Anything)
Baby, let me change your life
You oughta be (Everything, oughta be)
You oughta be anything (Anything, anything, yeah)
Baby, I can make you right (Ooh woah)
You wanna see (Everything, I see)
That you can be anything you want (Anything)
Baby, let me change your life (Let me)
You wanna be (Everything, if you wanna be)
You wanna be anything
You could be anything, everything

[Verse 3: Kehlani]
Look, wanna be a lover? I can teach you love, yeah
Wanna be a hubby? You can wife me up (Yeah)
Wanna be a chef? Go on and spice it up
Wanna be a boxer? Beat it up, don't ever need no glove
Wanna retire, different bitches your lifestyle
Used-to-be models, IG honeys all shaped like bottles
But now you seein' that it's more than body, face, and smile (Yeah)
You see me, and you look beyond it, you feel inspired (Yeah)
I'm here to excel with you
Here to break bread with you
Here to travel the world and sleep in different beds with you
Here to make revenue
Know it's impressin' you

[Chorus: Kehlani]
Baby, let me change your life
You wanna see (Everything)
That you can be anything you want (Anything)
Baby, let me change your life
You oughta be (Everything)
You oughta be anything (Anything)
Baby, I can make you right
You wanna see (Everything)
That you can be anything you want (Anything)
Baby, let me change your life
You wanna be (Anything)
You wanna be anything (Anything, wanna be)
You could be anything, everything"
God Whispered Your Name,Keith Urban,"[Verse 1]
I was so cold and lost
And nothing seemed to ring true
I couldn't bear the cross
For everything I'd been through
And each day, I knew I needed change
But there was no way, no way

[Chorus]
And then God whispered your name
And that's when everything changed
And love came out of the rain
And talk about being saved
Suddenly I wanna live
More than I ever did
I'm never gonna be the same
When God whispered your name

[Verse 2]
I can see the sunshine
For the first time in a while
Girl, it's like I've been baptized
By the warmth of your smile, hmm
Well, call it fate or faith or call it crazy either way
It's amazin', amazin' grace

[Chorus]
When God whispered your name
That's when everything changed
Love came out of the rain
Talk about being saved
Well, suddenly I wanna live
More than I ever did
I'm never gonna be the same
When God whispered your name

[Bridge]
It's just what I needed to hear, baby
It couldn't have been more loud and clear

[Chorus]
When God whispered your name
That's when everything changed
Love came out of the rain (Out of the rain)
And talk about being saved
Oh, suddenly I wanna live
More than I ever did
I'm never gonna be the same
When God whispered your name, oh yeah

[Outro]
(Hallelujah, Hallelujah
Hallelujah)
Ooh, Hallelujah, baby
(Hallelujah) Oh, yeah, (Hallelujah) Hmm-hmm
(Hallelujah) Ooh yeah
I can see the sunlight shinin' through your pretty eyes, baby
(Hallelujah) Woo, hmm, (Hallelujah)
I like a man who leaves, time feels like Hell
(Hallelujah)
Got my hands up high, I got my hands up to the sky
(Hallelujah) Ooh, I'm sayin' thank you
(Hallelujah
Hallelujah, Hallelujah
Hallelujah, Hallelujah
Hallelujah)"
Die From A Broken Heart,Maddie & Tae,"[Verse 1: Maddie, Both]
Hey mama, how do you get a red wine stain
Out of your favorite dress?
Black mascara off a pillowcase?
Cure a one-too-many headache?
Mama, can I come and maybe stay a few days
This weekend or next?
And hey, how do you get a red wine stain
Out of your favorite dress?

[Chorus: Both]
How does he sleep at night?
Mama, the nerve of this guy
To leave me so easy
Am I gonna be alright?
I wanna kick myself for falling so hard
Mama, can you die from a broken heart?

[Verse 2: Both, Maddie]
Can you ask Daddy if he's got time
To come and look at my front door?
It got slammed last night
And now it don't close right
And just promise that you won't tell him everything
And keep that pistol in the drawer
Mama, please don't say
I'm gonna laugh about this someday
You didn't see the way he drove away

[Chorus: Both]
How does he sleep at night?
Mama, the nerve of this guy
To leave me so easy
Am I gonna be alright?
I wanna kick myself for falling so hard
Mama, can you die from a broken heart?
Oh, a broken heart

[Bridge: Maddie, Tae, Both]
Can your knees give out from prayin' so hard? (Prayin' so hard)
Can you go blind from crying in the dark? (In the dark)
Was it ever really real
If he don't feel like I feel?

[Chorus: Both, Maddie]
How does he sleep at night?
Mama, the nerve of this guy
To leave me so easy
Am I gonna be alright?
How does he sleep at night?
Mama, the nerve of this guy
To leave me so easy
Am I gonna be alright?
I wanna kick myself for falling so hard
Mama, can you die from a broken heart?
A broken heart"
Catch,Brett Young,"[Verse 1]
I wasn't tryna feel like this
I wasn't tryna feel nothin' at all
I just came to meet my friends
And try to drink a long week off
I didn't want to stay too late
I wasn't tryna close it down
I was doin' my own thing
Yeah, up until you sat down

[Chorus]
I thought that I'd
Catch a buzz, catch a game
Catch up with the boys, the same old thing
Catch a cab back to my place
But then I saw your face
Now you got me tryna
Catch your eye, catch your name
Catch a spark and start a flame
The way you smile and I can't help myself
Girl, you got me tryna catch my breath
You got me tryna catch my breath, yeah

[Verse 2]
You got me doin' double-takes
You went and messed up all my plans
I only meant to hold this drink
Now I'm tryna hold your hand

[Chorus]
Yeah, I thought that I'd
Catch a buzz, catch a game
Catch up with the boys, the same old thing
Catch a cab back to my place
But then I saw your face
Now you got me tryna
Catch your eye, catch your name
Catch a spark and start a flame
The way you smile and I can't help myself
Girl, you got me tryna catch my breath, whoa
Ooh, you got me tryna catch my breath, whoa

[Bridge]
You got me catchin' feelin's
I wasn't even tryna feel this
I don't know how you started stealin'
My heart like you are in this bar
But I'm glad that you are

[Chorus]
'Cause I just thought that I'd
Catch a buzz, catch a game
Catch up with the boys, the same old thing
Catch a cab back to my place
But then I saw your face
Now you got me tryna
Catch your eye, catch your name
Catch a spark and start a flame
The way you smile and I can't help myself
Girl, you got me tryna catch my breath, oh
You got me tryna catch my breath, yeah
Ooh, you got me tryna catch my breath, whoa
You got me tryna catch my breath, whoa"
